Symbol,Alias,Description,Function,Gene_Set,Species,Literature_Name,Literature_Link,KEGG_ID,KEGG_Name,Gene_ID
Taf1,"Nscl2; Tafii250; Kat4","TATA-box binding protein associated factor 1","Essential in cell cycle progression, TAF1 is also involved in transcription as part of the TFIID transcription factor together with?TBP. due to TAF1's importance in cell cycle control and its relation with other proteins previously related to ageing, TAF1 might play some role in human ageing.","cellular senescence","Mus musculus","Sustained Expression of a Neuron-Specific Isoform of the Taf1 Gene in Development Stages and Aging in Mice",10.1126/science.1102898,unknown,Unknown,270627
Tbp,"Tfiid; Gtf2d1; Sca17","TATA box binding protein","TBP is part of the TFIID general transcription factor. Because of its central role in the activation of eukaryotic genes, TBP is potentially involved in a large variety of processes. TBP-null mice die at embryonic stages. Mutations in the human TBP gene have been associated with neurological diseases.","genomic instability","Mus musculus","RNA Polymerase II Transcription in Murine Cells Lacking the TATA Binding Protein",10.1126/science.1102899,unknown,Unknown,21374
Tcf3,"Kappa-E2-Binding Factor","transcription factor 3","Transcriptional regulator. Involved in the initiation of neuronal differentiation. Heterodimers between TCF3 and tissue-specific basic helix-loop-helix (bHLH) proteins play major roles in determining tissue-specific cell fate during embryogenesis, like muscle or early B-cell differentiation. Dimers bind DNA on E-box motifs: 5'-CANNTG-3'. Binds to the kappa-E2 site in the kappa immunoglobulin gene enhancer. Binds to IEB1 and IEB2, which are short DNA sequences in the insulin gene transcription control region.","cellular senescence","Mus musculus","E protein dosage influences brain development more than family member identity",10.1126/science.1102900,mmu04550,"Signaling pathways regulating pluripotency of stem cells",21423
Terc,"mTER; mTR","telomerase RNA component","The RNA component of Telomerase TERC is imported into mitochondria, processed to a shorter form TERC-53, and then exported back to the cytosol.","telomere attrition","Mus musculus","Mitochondrion-processed TERC regulates senescence without affecting telomerase activities",10.1126/science.1102901,unknown,Unknown,21748
Terf1,"Pin2; Trf1; TRrf","telomeric repeat binding factor 1","TERF1 associates with the telomeres and appears to be an important regulator of telomere biology. Expression of TERF1 in mice prevented age-related decline in neuromuscular function, glucose homeostasis, cognitive function, lipid stores, and chronic anemia.","telomere attrition","Mus musculus","Gene Therapy With the TRF1 Telomere Gene Rescues Decreased TRF1 Levels With Aging and Prolongs Mouse Health Span",10.1126/science.1102902,unknown,Unknown,21749
Terf2,"Trf2; Trbf2","telomeric repeat binding factor 2","TERF2 is a component of shelterin and together with?TERF1, appears to play an important role in telomere biology. In mice, overexpression of TERF2 in the skin results in a severe phenotype in response to light, including skin deterioration, hyperpigmentation and increased skin cancer.",others,"Mus musculus","Essential Role for the TRF2 Telomere Protein in Adult Skin Homeostasis",10.1126/science.1102903,unknown,Unknown,21750
Tert,"Tp2; Tr; Trt","telomerase reverse transcriptase","Telomerase is a ribonucleoprotein enzyme essential for the replication of chromosome termini in most eukaryotes. Active in progenitor and cancer cells. Inactive, or very low activity, in normal somatic cells.","telomere attrition","Mus musculus","Telomerase reverse transcriptase ameliorates lung fibrosis by protecting alveolar epithelial cells against senescence",10.1126/science.1102904,unknown,Unknown,21752
Tfap2a,"Ap-2; Tfap2; Ap2tf","transcription factor AP-2, alpha","Sequence-specific DNA-binding protein that interacts with inducible viral and cellular enhancer elements to regulate transcription of selected genes. AP-2 factors bind to the consensus sequence 5'-GCCNNNGGC-3' and activate genes involved in a large spectrum of important biological functions including proper eye, face, body wall, limb and neural tube development.","genomic instability","Mus musculus","Transcription Factor AP-2 Essential for Cranial Closure and Craniofacial Development",10.1126/science.1102905,unknown,Unknown,21418
Tfdp1,Dp1,"transcription factor Dp 1","Can stimulate E2F-dependent transcription. Binds DNA cooperatively with E2F family members through the E2 recognition site, 5'-TTTC[CG]CGC-3', found in the promoter region of a number of genes whose products are involved in cell cycle regulation or in DNA replication. The E2F1:DP complex appears to mediate both cell proliferation and apoptosis. Blocks adipocyte differentiation by repressing CEBPA binding to its target gene promoters.","cellular senescence","Mus musculus","Expression patterns of the E2F family of transcription factors during murine epithelial development",10.1126/science.1102906,mmu04110,"Cell cycle",21781
Tgfb1,"TGFbeta1; Tgfb; Tgfb-1","transforming growth factor, beta 1","Transforming growth factor beta-1 proprotein: Precursor of the Latency-associated peptide (LAP) and Transforming growth factor beta-1 (TGF-beta-1) chains, which constitute the regulatory and active subunit of TGF-beta-1, respectively.","altered intercellular communication","Mus musculus","Chronic treatment with the mitochondrial peptide humanin prevents age-related myocardial fibrosis in mice",10.1126/science.1102907,mmu04218,"Cellular senescence",21803
Timp2,Csc-21k,"TIMP Metallopeptidase Inhibitor 2","Complexes with metalloproteinases (such as collagenases) and irreversibly inactivates them by binding to their catalytic zinc cofactor. Known to act on MMP-1, MMP-2, MMP-3, MMP-7, MMP-8, MMP-9, MMP-10, MMP-13, MMP-14, MMP-15, MMP-16 and MMP-19.","senescence-associated secretory phenotype","Mus musculus","Protective Effects of Kuding Tea ( Ilex kudingcha C. J. Tseng) Polyphenols on UVB-Induced Skin Aging in SKH1 Hairless Mice",10.3390/molecules24061016,unknown,Unknown,21858
Tirap,Myd88-2,"TIR Domain Containing Adaptor Protein","Adapter involved in TLR2 and TLR4 signaling pathways in the innate immune response. Acts via IRAK2 and TRAF-6, leading to the activation of NF-kappa-B, MAPK1, MAPK3 and JNK, and resulting in cytokine secretion and the inflammatory response. Positively regulates the production of TNF-alpha and interleukin-6.","NF-κB related gene","Mus musculus","Experimental study and biomechanical characterization for the passive small intestine: Identification of regional differences",10.1016/j.jmbbm.2017.05.026,mmu04064,"NF-kappa B signaling pathway",117149
Tlr2,"Ly10; Ly105","toll-like receptor 2","TLR2 signaling is essential for protecting the heart against aging-associated adverse remodeling and contractile dysfunction in mice.",others,"Mus musculus","Toll-like receptor 2 deficiency hyperactivates the FoxO1 transcription factor and induces aging-associated cardiac dysfunction in mice",10.1074/jbc.RA118.001880,mmu04151,"PI3K-Akt signaling pathway",24088
Tlr4,Armd10,"Toll Like Receptor 4","Cooperates with LY96 and CD14 to mediate the innate immune response to bacterial lipopolysaccharide (LPS) . Acts via MYD88, TIRAP and TRAF6, leading to NF-kappa-B activation, cytokine secretion and the inflammatory response . Also involved in LPS-independent inflammatory responses triggered by free fatty acids, such as palmitate, and Ni(2+). Responses triggered by Ni(2+) require non-conserved histidines and are, therefore, species-specific. Both M.tuberculosis HSP70 (dnaK) and HSP65 (groEL-2) act via this protein to stimulate NF-kappa-B expression.","NF-κB related gene","Mus musculus","Toll-like receptor 4 (TLR4) deficient mice are protected from adipose tissue inflammation in aging",10.18632/aging.101288,mmu04064,"NF-kappa B signaling pathway",21898
Tnf,"Tnfsf2; Dif; Tnf-alpha","tumor necrosis factor","A cytokine involved in the immune response, TNF can induce cell death in some tumour cells. It can also induce cellular proliferation and differentiation. TNF may protect neurons by stimulating antioxidant pathways.","altered intercellular communication","Mus musculus","Characterization of Tumor Necrosis Factor-Deficient Mus musculus",10.1126/science.1102908,mmu04150,"mTOR signaling pathway",21926
Tnfaip3,"Zinc finger protein a20","TNF Alpha Induced Protein 3","Ubiquitin-editing enzyme that contains both ubiquitin ligase and deubiquitinase activities. Involved in immune and inflammatory responses signaled by cytokines, such as TNF-alpha and IL-1 beta, or pathogens via Toll-like receptors (TLRs) through terminating NF-kappa-B activity. Essential component of a ubiquitin-editing protein complex, comprising also RNF11, ITCH and TAX1BP1, that ensures the transient nature of inflammatory signaling pathways. In cooperation with TAX1BP1 promotes disassembly of E2-E3 ubiquitin protein ligase complexes in IL-1R and TNFR-1 pathways; affected are at least E3 ligases TRAF6, TRAF2 and BIRC2, and E2 ubiquitin-conjugating enzymes UBE2N and UBE2D3. In cooperation with TAX1BP1 promotes ubiquitination of UBE2N and proteasomal degradation of UBE2N and UBE2D3.","NF-κB related gene","Mus musculus","A20 prevents inflammasome-dependent arthritis by inhibiting macrophage necroptosis through its ZnF7 ubiquitin-binding domain",10.1038/s41556-019-0324-3,mmu04064,"NF-kappa B signaling pathway",21929
Tnfrsf11a,Rank,"TNF Receptor Superfamily Member 11a","Receptor for TNFSF11/RANKL/TRANCE/OPGL; essential for RANKL-mediated osteoclastogenesis. Involved in the regulation of interactions between T-cells and dendritic cells.","NF-κB related gene","Mus musculus","Articular cartilage protection in Ctsk -/- mice is associated with cellular and molecular changes in subchondral bone and cartilage matrix",10.1002/jcp.26745,mmu04064,"NF-kappa B signaling pathway",21934
Tnfrsf13c,Cd268,"TNF Receptor Superfamily Member 13C","B-cell receptor specific for TNFSF13B/TALL1/BAFF/BLyS. Promotes the survival of mature B-cells and the B-cell response.","NF-κB related gene","Mus musculus","mTOR-Dependent and Independent Survival Signaling by PI3K in B Lymphocytes",10.1371/journal.pone.0146955,mmu04064,"NF-kappa B signaling pathway",72049
Tnfrsf1a,Tnf-r-i,"TNF Receptor Superfamily Member 1A","Receptor for TNFSF2/TNF-alpha and homotrimeric TNFSF1/lymphotoxin-alpha. The adapter molecule FADD recruits caspase-8 to the activated receptor. The resulting death-inducing signaling complex (DISC) performs caspase-8 proteolytic activation which initiates the subsequent cascade of caspases (aspartate-specific cysteine proteases) mediating apoptosis. Contributes to the induction of non-cytocidal TNF effects including anti-viral state and activation of the acid sphingomyelinase.","senescence-associated secretory phenotype","Mus musculus","RIPK1 maintains epithelial homeostasis by inhibiting apoptosis and necroptosis",10.1038/nature13608,mmu04010,"MAPK signaling pathway",21937
Tnfrsf1b,Tnfbr,"TNF Receptor Superfamily Member 1B","Receptor with high affinity for TNFSF2/TNF-alpha and approximately 5-fold lower affinity for homotrimeric TNFSF1/lymphotoxin-alpha. The TRAF1/TRAF2 complex recruits the apoptotic suppressors BIRC2 and BIRC3 to TNFRSF1B/TNFR2. This receptor mediates most of the metabolic effects of TNF-alpha. Isoform 2 blocks TNF-alpha-induced apoptosis, which suggests that it regulates TNF-alpha function by antagonizing its biological activity.","senescence-associated secretory phenotype","Mus musculus","Chronic disruptions of circadian sleep regulation induce specific proinflammatory responses in the rat colon",10.1080/07420528.2017.1361436,mmu04060,"Cytokine-cytokine receptor interaction",21938
Tnfsf11,Rankl,"TNF Superfamily Member 11","Cytokine that binds to TNFRSF11B/OPG and to TNFRSF11A/RANK. Osteoclast differentiation and activation factor. Augments the ability of dendritic cells to stimulate naive T-cell proliferation. May be an important regulator of interactions between T-cells and dendritic cells and may play a role in the regulation of the T-cell-dependent immune response. May also play an important role in enhanced bone-resorption in humoral hypercalcemia of malignancy. Induces osteoclastogenesis by activating multiple signaling pathways in osteoclast precursor cells, chief among which is induction of long lasting oscillations in the intracellular concentration of Ca (2+) resulting in the activation of NFATC1, which translocates to the nucleus and induces osteoclast-specific gene transcription to allow differentiation of osteoclasts. During osteoclast differentiation, in a TMEM64 and ATP2A2-dependent manner induces activation of CREB1 and mitochondrial ROS generation necessary for proper osteoclast generation.","NF-κB related gene","Mus musculus","Erythropoietin does not improve fracture healing in aged mice",10.1016/j.exger.2019.04.005,mmu04064,"NF-kappa B signaling pathway",21943
Tnfsf13b,Baff,"TNF Superfamily Member 13","Cytokine that binds to TNFRSF13B/TACI and TNFRSF17/BCMA. TNFSF13/APRIL binds to the same 2 receptors. Together, they form a 2 ligands -2 receptors pathway involved in the stimulation of B- and T-cell function and the regulation of humoral immunity. A third B-cell specific BAFF-receptor (BAFFR/BR3) promotes the survival of mature B-cells and the B-cell response.","NF-κB related gene","Mus musculus","Molecular structure, distribution, and immunology function of TNFSF13B (BAFF) in Nile tilapia (Oreochromis niloticus)",10.1016/j.fsi.2016.02.026,mmu04064,"NF-kappa B signaling pathway",24099
Tnfsf14,Hvem-l,"TNF Superfamily Member 14","Cytokine that binds to TNFRSF3/LTBR. Binding to the decoy receptor TNFRSF6B modulates its effects. Acts as a ligand for TNFRSF14/HVEM . Upon binding to TNFRSF14/HVEM, delivers costimulatory signals to T cells, leading to T cell proliferation and IFNG production.","NF-κB related gene","Mus musculus","Myocyte-derived Tnfsf14 is a survival factor necessary for myoblast differentiation and skeletal muscle regeneration",10.1038/cddis.2015.375,mmu04064,"NF-kappa B signaling pathway",50930
Top1,"Scl-70 Antigen","topoisomerase (DNA) I","This gene encodes a DNA topoisomerase, an enzyme that controls and alters the topologic states of DNA during transcription. This enzyme catalyzes the transient breaking and rejoining of a single strand of DNA which allows the strands to pass through one another, thus altering the topology of DNA.",others,"Mus musculus","DNA Topoisomerase I in the Mus musculus Central Nervous System: Age and Sex Dependence",10.1126/science.1102909,unknown,Unknown,21969
Top2a,"DNA Topoisomerase 2-Alpha","topoisomerase (DNA) II alpha","Control of topological states of DNA by transient breakage and subsequent rejoining of DNA strands. Topoisomerase II makes double-strand breaks. Essential during mitosis and meiosis for proper segregation of daughter chromosomes. May play a role in regulating the period length of ARNTL/BMAL1 transcriptional oscillation.","cellular senescence","Mus musculus","Characterization of cDNA encoding the mouse DNA topoisomerase II that can complement the budding yeast top2 mutation",10.1126/science.1102910,unknown,Unknown,21973
Top2b,"D230016L12Rik; Top-2","topoisomerase (DNA) II beta","Control of topological states of DNA by transient breakage and subsequent rejoining of DNA strands. Topoisomerase II makes double-strand breaks.",others,"Mus musculus","Topoisomerase IIβ and its role in different biological contexts",10.1126/science.1102911,unknown,Unknown,21974
Top3b,"Topoisomerase (DNA) III Beta","topoisomerase (DNA) III beta","This gene encodes a DNA topoisomerase, an enzyme that controls and alters the topologic states of DNA during transcription. This enzyme catalyzes the transient breaking and rejoining of a single strand of DNA which allows the strands to pass through one another, thus relaxing the supercoils and altering the topology of DNA. The enzyme interacts with DNA helicase SGS1 and plays a role in DNA recombination.","altered intercellular communication","Mus musculus","Development of Autoimmunity in Mice Lacking DNA Topoisomerase 3beta",10.1126/science.1102912,unknown,Unknown,21976
Topors,Tp53bpl,"topoisomerase I binding, arginine/serine-rich","Functions as an E3 ubiquitin-protein ligase and as a E3 SUMO1-protein ligase. Probable tumor suppressor involved in cell growth, cell proliferation and apoptosis that regulates p53/TP53 stability through ubiquitin-dependent degradation. May regulate chromatin modification through sumoylation of several chromatin modification-associated proteins. May be involved in DNA-damage-induced cell death through IKBKE sumoylation.","loss of proteostasis","Mus musculus","DJ-1 restores p53 transcription activity inhibited by Topors/p53BP3",10.1126/science.1102913,unknown,Unknown,106021
Tp53,"P53; Lfs1","transformation related protein 53","TP53 is a tumour suppressor involved in cell cycle regulation, apoptosis, and DNA repair. Several lines of evidence from model organisms link TP53 to ageing, in agreement with its DNA damage protection role.",others,"Mus musculus","Relevance of the p53-MDM2 Axis to Aging",10.1126/science.1102914,unknown,Unknown,22059
Tpp2,"Tpp-2; TppII","tripeptidyl peptidase II","Component of the proteolytic cascade acting downstream of the 26S proteasome in the ubiquitin-proteasome pathway. May be able to complement the 26S proteasome function to some extent under conditions in which the latter is inhibited.","loss of proteostasis","Mus musculus","Early-onset Evans syndrome, immunodeficiency, and premature immunosenescence associated with tripeptidyl-peptidase II deficiency",10.1126/science.1102915,unknown,Unknown,22019
Tradd,"Tumor necrosis factor receptor type 1 associated death domain protein","TNFRSF1A Associated Via Death Domain","The nuclear form acts as a tumor suppressor by preventing ubiquitination and degradation of isoform p19ARF/ARF of CDKN2A by TRIP12: acts by interacting with TRIP12, leading to disrupt interaction between TRIP12 and isoform p19ARF/ARF of CDKN2A (By similarity). Adapter molecule for TNFRSF1A/TNFR1 that specifically associates with the cytoplasmic domain of activated TNFRSF1A/TNFR1 mediating its interaction with FADD. Overexpression of TRADD leads to two major TNF-induced responses, apoptosis and activation of NF-kappa-B.","NF-κB related gene","Mus musculus","Impaired autophagy and APP processing in Alzheimer's disease: The potential role of Beclin 1 interactome",10.1016/j.pneurobio.2013.06.002,mmu04064,"NF-kappa B signaling pathway",71609
Traf1,Ebi6,"TNF Receptor Associated Factor 1","Adapter molecule that regulates the activation of NF-kappa-B and JNK. Plays a role in the regulation of cell survival and apoptosis. The heterotrimer formed by TRAF1 and TRAF2 is part of a E3 ubiquitin-protein ligase complex that promotes ubiquitination of target proteins, such as MAP3K14. The TRAF1/TRAF2 complex recruits the antiapoptotic E3 protein-ubiquitin ligases BIRC2 and BIRC3 to TNFRSF1B/TNFR2.","NF-κB related gene","Mus musculus","Inhibition of nitric oxide in LPS-stimulated macrophages of young and senescent mice by δ-tocotrienol and quercetin",10.1186/1476-511X-10-239,mmu04064,"NF-kappa B signaling pathway",22029
Traf2,Trap3,"TNF Receptor Associated Factor 2","Regulates activation of NF-kappa-B and JNK and plays a central role in the regulation of cell survival and apoptosis. Required for normal antibody isotype switching from IgM to IgG. Has E3 ubiquitin-protein ligase activity and promotes 'Lys-63'-linked ubiquitination of target proteins, such as BIRC3, RIPK1 and TICAM1. Is an essential constituent of several E3 ubiquitin-protein ligase complexes, where it promotes the ubiquitination of target proteins by bringing them into contact with other E3 ubiquitin ligases. Regulates BIRC2 and BIRC3 protein levels by inhibiting their autoubiquitination and subsequent degradation; this does not depend on the TRAF2 RING-type zinc finger domain. Plays a role in mediating activation of NF-kappa-B by EIF2AK2/PKR. In complex with BIRC2 or BIRC3, promotes ubiquitination of IKBKE.","NF-κB related gene","Mus musculus","Bone Remodeling and the Role of TRAF3 in Osteoclastic Bone Resorption",10.3389/fimmu.2018.02263,mmu04064,"NF-kappa B signaling pathway",22030
Traf3,Lap1,"TNF Receptor Associated Factor 3","Regulates pathways leading to the activation of NF-kappa-B and MAP kinases, and plays a central role in the regulation of B-cell survival. Part of signaling pathways leading to the production of cytokines and interferon. Required for normal antibody isotype switching from IgM to IgG. Plays a role T-cell dependent immune responses. Plays a role in the regulation of antiviral responses. Is an essential constituent of several E3 ubiquitin-protein ligase complexes. May have E3 ubiquitin-protein ligase activity and promote 'Lys-63'-linked ubiquitination of target proteins. Inhibits activation of NF-kappa-B in response to LTBR stimulation. Inhibits TRAF2-mediated activation of NF-kappa-B. Down-regulates proteolytic processing of NFKB2, and thereby inhibits non-canonical activation of NF-kappa-B. Promotes ubiquitination and proteasomal degradation of MAP3K14.","NF-κB related gene","Mus musculus","Bone Remodeling and the Role of TRAF3 in Osteoclastic Bone Resorption",10.3389/fimmu.2018.02263,mmu04064,"NF-kappa B signaling pathway",22031
Traf5,Rnf84,"TNF Receptor Associated Factor 5","Adapter protein and signal transducer that links members of the tumor necrosis factor receptor family to different signaling pathways by association with the receptor cytoplasmic domain and kinases. Mediates activation of NF-kappa-B and probably JNK. Seems to be involved in apoptosis. Plays a role in mediating activation of NF-kappa-B by EIF2AK2/PKR.","NF-κB related gene","Mus musculus","CHIP regulates bone mass by targeting multiple TRAF family members in bone marrow stromal cells",10.1038/s41413-018-0010-2,mmu04064,"NF-kappa B signaling pathway",22033
Traf6,Rnf85,"TNF Receptor Associated Factor 6","E3 ubiquitin ligase that, together with UBE2N and UBE2V1, mediates the synthesis of 'Lys-63'-linked-polyubiquitin chains conjugated to proteins, such as IKBKG, IRAK1, AKT1 and AKT2. Also mediates ubiquitination of free/unanchored polyubiquitin chain that leads to MAP3K7 activation. Leads to the activation of NF-kappa-B and JUN. May be essential for the formation of functional osteoclasts. Seems to also play a role in dendritic cells (DCs) maturation and/or activation. Represses c-Myb-mediated transactivation, in B-lymphocytes. Adapter protein that seems to play a role in signal transduction initiated via TNF receptor, IL-1 receptor and IL-17 receptor. Regulates osteoclast differentiation by mediating the activation of adapter protein complex 1 (AP-1) and NF-kappa-B, in response to RANK-L stimulation. Together with MAP3K8, mediates CD40 signals that activate ERK in B-cells and macrophages, and thus may play a role in the regulation of immunoglobulin production.","NF-κB related gene","Mus musculus","TLR-independent anti-inflammatory function of intestinal epithelial TRAF6 signalling prevents DSS-induced colitis in mice",10.1136/gutjnl-2014-308323,mmu04064,"NF-kappa B signaling pathway",22034
Trap1,Hsp75,"TNF receptor-associated protein 1","Chaperone that expresses an ATPase activity. Involved in maintaining mitochondrial function and polarization, downstream of PINK1 and mitochondrial complex I. Is a negative regulator of mitochondrial respiration able to modulate the balance between oxidative phosphorylation and aerobic glycolysis.","mitochondrial dysfunction","Mus musculus","Past, present, and emerging roles of mitochondrial heat shock protein TRAP1 in the metabolism and regulation of cancer stem cells",10.1126/science.1102916,unknown,Unknown,68015
Trim25,Rnf147,"Tripartite Motif Containing 25","unctions as a ubiquitin E3 ligase and as an ISG15 E3 ligase . Involved in innate immune defense against viruses by mediating ubiquitination of DDX58 and IFIH1. Mediates 'Lys-63'-linked polyubiquitination of the DDX58 N-terminal CARD-like region and may play a role in signal transduction that leads to the production of interferons in response to viral infection . Mediates 'Lys-63'-linked polyubiquitination of IFIH1 . Promotes ISGylation of 14-3-3 sigma (SFN), an adapter protein implicated in the regulation of a large spectrum signaling pathway . Mediates estrogen action in various target organs . Mediates the ubiquitination and subsequent proteasomal degradation of ZFHX3.","NF-κB related gene","Mus musculus","The molecular mechanisms of estrogen action against senile disease",10.3143/geriatrics.36.95,mmu04064,"NF-kappa B signaling pathway",217069
Trp53bp1,Tp53bp1,"transformation related protein 53 binding protein 1","Double-strand break (DSB) repair protein involved in response to DNA damage, telomere dynamics and class-switch recombination (CSR) during antibody genesis.","genomic instability","Mus musculus","β Cell Aging Markers Have Heterogeneous Distribution and Are Induced by Insulin Resistance",10.1126/science.1102917,unknown,Unknown,27223
Trp63,"P63; P73l; Tp73l; Tp63","transformation related protein 63","Acts as a sequence specific DNA binding transcriptional activator or repressor. The isoforms contain a varying set of transactivation and auto-regulating transactivation inhibiting domains thus showing an isoform specific activity.","genomic instability","Mus musculus","A new mutation in TP63 is associated with age-related pathology",10.1126/science.1102918,unknown,Unknown,22061
